{
 "schema_version": "2.0.0",
 "level": 2,
 "building_id": "prelim:file_10",
 "nodes": [
  {
   "id": "c000",
   "kind": "corridor",
   "area": null,
   "centroid": [
    270.0,
    386.0
   ],
   "label": "corridor",
   "attrs": {}
  },
  {
   "id": "r2c_door_1",
   "kind": "door",
   "area": null,
   "centroid": [
    190.0,
    429.0
   ],
   "label": "room-corridor door",
   "attrs": {}
  },
  {
   "id": "r2c_door_2",
   "kind": "door",
   "area": null,
   "centroid": [
    384.0,
    352.0
   ],
   "label": "room-corridor door",
   "attrs": {}
  },
  {
   "id": "room_1",
   "kind": "room",
   "area": null,
   "centroid": [
    542.0,
    433.0
   ],
   "label": null,
   "attrs": {}
  },
  {
   "id": "room_2",
   "kind": "room",
   "area": null,
   "centroid": [
    113.0,
    452.0
   ],
   "label": null,
   "attrs": {}
  }
 ],
 "edges": [
  {
   "u": "c000",
   "v": "r2c_door_1",
   "delta": null
  },
  {
   "u": "c000",
   "v": "r2c_door_2",
   "delta": null
  },
  {
   "u": "r2c_door_1",
   "v": "room_2",
   "delta": null
  },
  {
   "u": "r2c_door_2",
   "v": "room_1",
   "delta": null
  }
 ],
 "containment": {},
 "meta": {
  "source": "topospec.data.tesseract",
  "pipeline": "Tesseract2 (github.com/YaqoobAnsari/Tesseract2)",
  "source_json": "/data1/yansari/PhD/topofield/Tesseract2/Results/Json/file_10/file_10_post_pruning.json",
  "units": "image pixels",
  "n_rooms": 2,
  "n_corridor_components": 1,
  "n_transitions": 0,
  "n_doors": 2,
  "n_exit_doors": 0,
  "n_subnodes_contracted": 0,
  "n_outside_dropped": 0
 }
}
